,rank,name,link,rate,description,adress,city,latitude,longitude
397,20,Le Hameau du Comté de Foix,https://www.booking.com/hotel/fr/le-hameau-du-comte-de-foix.fr.html?aid=304142&ucfs=1&arphpl=1&group_adults=2&req_adults=2&no_rooms=1&group_children=0&req_children=0&hpos=20&hapos=20&sr_order=popularity&srpvid=20ce50af58850217&srepoch=1643974113&from=searchresults#hotelTmpl,"8,7","Installé à Mercus-Garrabet, à 33 km d'Ax-les-Thermes, Le Hameau du Comté de Foix propose un jardin et une connexion Wi-Fi gratuite. ","8 rue de la Rivière, 09400 Mercus-Garrabet, France",Ariege,42.894682849999995,1.6349408137155774
398,21,La Caminada Vielha,https://www.booking.com/hotel/fr/la-caminada-vielha.fr.html?aid=304142&ucfs=1&arphpl=1&group_adults=2&req_adults=2&no_rooms=1&group_children=0&req_children=0&hpos=21&hapos=21&sr_order=popularity&srpvid=20ce50af58850217&srepoch=1643974113&from=searchresults#hotelTmpl,"9,5","Situé à Montaillou, à 34 km de Font-Romeu, l'établissement La Caminada Vielha dispose d'une terrasse et d'une connexion Wi-Fi gratuite. ","5 Quartier Barri d'Amont, 09110 Montaillou, France",Ariege,42.783718699999994,1.9020824148241187
399,22,Belloreade,https://www.booking.com/hotel/fr/belloreade.fr.html?aid=304142&ucfs=1&arphpl=1&group_adults=2&req_adults=2&no_rooms=1&group_children=0&req_children=0&hpos=22&hapos=22&sr_order=popularity&srpvid=20ce50af58850217&srepoch=1643974113&from=searchresults#hotelTmpl,"9,6","Situé à Belloc, le Belloreade dispose d'une piscine extérieure ouverte en saison, d'un bain à remous et d'une salle de massage disponible toute l'année. ","Chemin du Carme, 09600 Belloc, France",Ariege,44.0333425,0.338219
400,23,la maison du bonheur chez Yann HUMBLET,https://www.booking.com/hotel/fr/la-maison-du-bonheur-moulis.fr.html?aid=304142&ucfs=1&arphpl=1&group_adults=2&req_adults=2&no_rooms=1&group_children=0&req_children=0&hpos=23&hapos=23&sr_order=popularity&srpvid=20ce50af58850217&srepoch=1643974113&from=searchresults#hotelTmpl,"8,3","Située à Moulis, la maison du bonheur chez Yann HUMBLET dispose d'un salon commun, d'un jardin et d'un barbecue. Vous bénéficierez gratuitement d'un parking privé et d'une connexion Wi-Fi. ","lieu-dit rémillassé, 09200 Moulis, France",Ariege,42.9604715,1.0924298
401,24,la maison d'Anna,https://www.booking.com/hotel/fr/la-maison-d-39-anna-ganac.fr.html?aid=304142&ucfs=1&arphpl=1&group_adults=2&req_adults=2&no_rooms=1&group_children=0&req_children=0&hpos=24&hapos=24&sr_order=popularity&srpvid=20ce50af58850217&srepoch=1643974113&from=searchresults#hotelTmpl,"9,4","La maison d'Anna vous accueille dans une ancienne ferme située à Ganac, à 3 km de Foix. Vous pourrez profiter gratuitement d'une connexion Wi-Fi et d'un parking privé sur place. ","lieu dit Camparnaud, 10 route de Foix, 09000 Ganac, France",Ariege,42.9471082,1.5624514
402,25,Studio au Coeur du Village avec terrasse et parking proche de Pamiers,https://www.booking.com/hotel/fr/studio-au-coeur-du-village.fr.html?aid=304142&ucfs=1&arphpl=1&group_adults=2&req_adults=2&no_rooms=1&group_children=0&req_children=0&hpos=25&hapos=25&sr_order=popularity&srpvid=20ce50af58850217&srepoch=1643974113&from=searchresults#hotelTmpl,"9,4","Situé à Pamiers, le Studio au Coeur du Village avec terrasse et parking proche de Pamiers propose un hébergement avec une terrasse et une connexion Wi-Fi gratuite. ","4 Rue de la Petite Carrière, 09340 Pamiers, France",Ariege,42.9381614,1.8515703
403,1,Escale Oceania Saint Malo,https://www.booking.com/hotel/fr/mascottesaintmalo.fr.html?aid=304142&ucfs=1&arphpl=1&group_adults=2&req_adults=2&no_rooms=1&group_children=0&req_children=0&hpos=1&hapos=1&sr_order=popularity&srpvid=bb9e50de819a01c2&srepoch=1643974205&from=searchresults#hotelTmpl,"8,2","L'Escale Oceania Saint Malo se trouve sur le front de mer, en face de la plage du Sillon, à 14 minutes de marche de la gare de Saint-Malo. ","76 Chaussée du Sillon, Sillon, 35400 Saint-Malo, France",St Malo,48.6541426,-2.008697727859329
404,2,Hotel De L'univers,https://www.booking.com/hotel/fr/de-l-univers.fr.html?aid=304142&ucfs=1&arphpl=1&group_adults=2&req_adults=2&no_rooms=1&group_children=0&req_children=0&hpos=2&hapos=2&sr_order=popularity&srpvid=bb9e50de819a01c2&srepoch=1643974205&from=searchresults#hotelTmpl,"8,1","L'Hotel De L'univers est installé dans la ville fortifiée de Saint-Malo, en Bretagne, à quelques pas du port ferry et de la gare. ","12 Place Chateaubriand, Intra muros, 35400 Saint-Malo, France",St Malo,48.6512513,-2.0238242
405,3,Oceania Saint Malo,https://www.booking.com/hotel/fr/oceaniasaintmalo.fr.html?aid=304142&ucfs=1&arphpl=1&group_adults=2&req_adults=2&no_rooms=1&group_children=0&req_children=0&hpos=3&hapos=3&sr_order=popularity&srpvid=bb9e50de819a01c2&srepoch=1643974205&from=searchresults#hotelTmpl,"8,4","Donnant sur la mer, l'Oceania Saint Malo se situe sur la Chaussée du Sillon, en face de la plage du même nom et à 450 mètres du port de plaisance de Saint-Malo. ","Chaussée du sillon, Sillon, 35400 Saint-Malo, France",St Malo,48.6548172,-2.0072132
406,4,Hôtel de France et Chateaubriand,https://www.booking.com/hotel/fr/de-france-et-chateaubriand.fr.html?aid=304142&ucfs=1&arphpl=1&group_adults=2&req_adults=2&no_rooms=1&group_children=0&req_children=0&hpos=4&hapos=4&sr_order=popularity&srpvid=bb9e50de819a01c2&srepoch=1643974205&from=searchresults#hotelTmpl,"7,9","Situé au cœur de la ville historique de Saint-Malo, l’Hôtel de France et Chateaubriand offre une vue imprenable sur la mer et le sillon, à 210 mètres du port de plaisance de Saint-Malo. ","Place Chateaubriand Bp 77, Intra muros, 35400 Saint-Malo, France",St Malo,48.657090755505465,-1.9895390959047399
407,5,Hôtel Cartier,https://www.booking.com/hotel/fr/cartier.fr.html?aid=304142&ucfs=1&arphpl=1&group_adults=2&req_adults=2&no_rooms=1&group_children=0&req_children=0&hpos=5&hapos=5&sr_order=popularity&srpvid=bb9e50de819a01c2&srepoch=1643974205&from=searchresults#hotelTmpl,"7,4","Situé au sein des murs fortifiés de Saint-Malo, l'Hôtel Cartier vous accueille à seulement 280 mètres du port de plaisance ainsi qu'à 500 mètres de la plage et de la Manche. ","1, Rue de la Corne de Cerf, Intra muros, 35400 Saint-Malo, France",St Malo,48.6501248,-2.0247763
408,6,"The Originals Boutique, Hôtel des Marins, Saint-Malo (Inter-Hotel)",https://www.booking.com/hotel/fr/dulouvresaintmalo.fr.html?aid=304142&ucfs=1&arphpl=1&group_adults=2&req_adults=2&no_rooms=1&group_children=0&req_children=0&hpos=6&hapos=6&sr_order=popularity&srpvid=bb9e50de819a01c2&srepoch=1643974205&from=searchresults#hotelTmpl,"8,6","Situé au cœur de la ville fortifiée de Saint-Malo, l'établissement The Originals Boutique, Hôtel des Marins, Saint-Malo (Inter-Hotel) propose des chambres modernes avec une télévision à écran plat et...","2, Rue des Marins, Intra muros, 35400 Saint-Malo, France",St Malo,48.6488754,-2.0248533
409,7,ibis Styles Saint Malo Port,https://www.booking.com/hotel/fr/ibis-styles-saint-malo-port.fr.html?aid=304142&ucfs=1&arphpl=1&group_adults=2&req_adults=2&no_rooms=1&group_children=0&req_children=0&hpos=7&hapos=7&sr_order=popularity&srpvid=bb9e50de819a01c2&srepoch=1643974205&from=searchresults#hotelTmpl,"8,0","Doté d'un snack-bar et d'une connexion Wi-Fi gratuite, l'établissement ibis Styles Saint Malo Port est situé à Saint-Malo, à moins de 10 minutes à pied des plages de sable, à 1 km de la gare ainsi...","6-8 Quai du Val, 35400 Saint-Malo, France",St Malo,48.6397068,-2.011455
410,8,Hotel Ajoncs d'Or,https://www.booking.com/hotel/fr/ajoncsdor.fr.html?aid=304142&ucfs=1&arphpl=1&group_adults=2&req_adults=2&no_rooms=1&group_children=0&req_children=0&hpos=8&hapos=8&sr_order=popularity&srpvid=bb9e50de819a01c2&srepoch=1643974205&from=searchresults#hotelTmpl,"8,6","L'hôtel Ajoncs d'Or se situe au cœur des remparts historiques de la ville fortifiée de Saint-Malo, à 350 mètres du port de plaisance de la ville. Vous bénéficierez gratuitement d'une connexion Wi-Fi. ","10 rue des Forgeurs, Intra muros, 35400 Saint-Malo, France",St Malo,48.6474678,-2.0252029
411,9,La Maison des Armateurs,https://www.booking.com/hotel/fr/la-maison-des-armateurs.fr.html?aid=304142&ucfs=1&arphpl=1&group_adults=2&req_adults=2&no_rooms=1&group_children=0&req_children=0&hpos=9&hapos=9&sr_order=popularity&srpvid=bb9e50de819a01c2&srepoch=1643974205&from=searchresults#hotelTmpl,"8,8","Situé dans le centre historique de Saint-Malo, l’établissement La Maison des Armateurs vous accueille à 5 minutes à pied de la cathédrale et à 120 mètres du port de plaisance. ","6, Grand Rue, Intra muros, 35400 Saint-Malo, France",St Malo,48.6489607,-2.0236067
412,10,Grand Hôtel Des Thermes,https://www.booking.com/hotel/fr/desthermessaintmalo.fr.html?aid=304142&ucfs=1&arphpl=1&group_adults=2&req_adults=2&no_rooms=1&group_children=0&req_children=0&hpos=10&hapos=10&sr_order=popularity&srpvid=bb9e50de819a01c2&srepoch=1643974205&from=searchresults#hotelTmpl,"8,0","Situé en bord de mer, le Grand Hôtel Des Thermes est un établissement de style Belle Époque doté d'un spa et d'une piscine intérieure. ","100 bd hebert, Sillon, 35400 Saint-Malo, France",St Malo,48.6578564,-1.9996225
413,11,Hotel Alba,https://www.booking.com/hotel/fr/alba-saint-malo.fr.html?aid=304142&ucfs=1&arphpl=1&group_adults=2&req_adults=2&no_rooms=1&group_children=0&req_children=0&hpos=11&hapos=11&sr_order=popularity&srpvid=bb9e50de819a01c2&srepoch=1643974205&from=searchresults#hotelTmpl,"7,5","L'hôtel Alba est situé à Saint-Malo, en face de la plage et à côté du port. Il comprend un bar et des chambres avec vue sur la mer et un accès direct à la plage. ","17 Rue Des Dunes, Sillon, 35400 Saint-Malo, France",St Malo,48.6565524,-2.0033145
414,12,L'AccrocheCoeur,https://www.booking.com/hotel/fr/l-39-accrochecoeur.fr.html?aid=304142&ucfs=1&arphpl=1&group_adults=2&req_adults=2&no_rooms=1&group_children=0&req_children=0&hpos=12&hapos=12&sr_order=popularity&srpvid=bb9e50de819a01c2&srepoch=1643974205&from=searchresults#hotelTmpl,"9,3","Situé à Saint-Malo, à 150 mètres de la plage de Bon Secours, L'AccrocheCoeur offre une vue sur la ville. ","9 Rue Thevenard, Intra muros, 35400 Saint-Malo, France",St Malo,48.6480917,-2.0269051
415,13,Hôtel La Porte Saint Pierre,https://www.booking.com/hotel/fr/sarl-porte-saint-pierre.fr.html?aid=304142&ucfs=1&arphpl=1&group_adults=2&req_adults=2&no_rooms=1&group_children=0&req_children=0&hpos=13&hapos=13&sr_order=popularity&srpvid=bb9e50de819a01c2&srepoch=1643974205&from=searchresults#hotelTmpl,"8,6","L'hôtel La Porte Saint Pierre est situé à l'intérieur des remparts historiques de la vieille ville de Saint-Malo, à seulement 10 mètres de la plage. ","2 Place du Guet, Intra muros, 35400 Saint-Malo, France",St Malo,48.6478657,-2.0281991
416,14,Hotel Ambassadeurs,https://www.booking.com/hotel/fr/ambassadeurs.fr.html?aid=304142&ucfs=1&arphpl=1&group_adults=2&req_adults=2&no_rooms=1&group_children=0&req_children=0&hpos=14&hapos=14&sr_order=popularity&srpvid=bb9e50de819a01c2&srepoch=1643974205&from=searchresults#hotelTmpl,"8,5","Situé sur le front de mer de Saint-Malo, l'Hotel Ambassadeurs vous accueille à 1,5 km du centre-ville et de la gare TGV. ","11 Chaussée Du Sillon, Sillon, 35400 Saint-Malo, France",St Malo,48.6547545,-2.0077501
417,15,Les Charmettes,https://www.booking.com/hotel/fr/les-charmettes.fr.html?aid=304142&ucfs=1&arphpl=1&group_adults=2&req_adults=2&no_rooms=1&group_children=0&req_children=0&hpos=15&hapos=15&sr_order=popularity&srpvid=bb9e50de819a01c2&srepoch=1643974205&from=searchresults#hotelTmpl,"8,6","Installé sur le front de mer dans la ville bretonne de Saint-Malo, l'hôtel Les Charmettes bénéficie d'un accès direct à la plage. ","64 Boulevard Hébert, Sillon, 35400 Saint-Malo, France",St Malo,48.659059,-1.9960795
418,16,ibis Saint-Malo Madeleine,https://www.booking.com/hotel/fr/ibis-saint-malo-madeleine.fr.html?aid=304142&ucfs=1&arphpl=1&group_adults=2&req_adults=2&no_rooms=1&group_children=0&req_children=0&hpos=16&hapos=16&sr_order=popularity&srpvid=bb9e50de819a01c2&srepoch=1643974205&from=searchresults#hotelTmpl,"7,9",L'hôtel ibis Saint-Malo Madeleine bénéficie d'une grande terrasse dotée du chauffage avec un coin salon couvert. La connexion Wi-Fi et le parking sur place sont gratuits. ,"Avenue du General De Gaulle / Impasse de La Peupleraie, 35400 Saint-Malo, France",St Malo,48.657090755505465,-1.9895390959047399
419,17,"Grand Hôtel de Courtoisville - Piscine & Spa, The Originals Relais (Relais du Silence)",https://www.booking.com/hotel/fr/grand-de-courtoisville.fr.html?aid=304142&ucfs=1&arphpl=1&group_adults=2&req_adults=2&no_rooms=1&group_children=0&req_children=0&hpos=17&hapos=17&sr_order=popularity&srpvid=bb9e50de819a01c2&srepoch=1643974205&from=searchresults#hotelTmpl,"7,8","Installé à 50 mètres de la plage, le Grand Hôtel de Courtoisville - Piscine & Spa, The Originals Relais (Relais du Silence) possède une piscine intérieure chauffée équipée d'un système de massage par...","9, rue Michelet, Sillon, 35400 Saint-Malo, France",St Malo,48.6582947,-1.9979684
420,18,Hôtel Le Beaufort,https://www.booking.com/hotel/fr/beaufort.fr.html?aid=304142&ucfs=1&arphpl=1&group_adults=2&req_adults=2&no_rooms=1&group_children=0&req_children=0&hpos=18&hapos=18&sr_order=popularity&srpvid=bb9e50de819a01c2&srepoch=1643974205&from=searchresults#hotelTmpl,"8,6","L'Hôtel Beaufort est situé directement sur la plage du Sillon, surplombant la baie de Saint-Malo. ","25 Chaussée Du Sillon, Sillon, 35400 Saint-Malo, France",St Malo,48.6550109,-2.0069062
421,19,Hôtel Le Nautilus,https://www.booking.com/hotel/fr/le-nautilus.fr.html?aid=304142&ucfs=1&arphpl=1&group_adults=2&req_adults=2&no_rooms=1&group_children=0&req_children=0&hpos=19&hapos=19&sr_order=popularity&srpvid=bb9e50de819a01c2&srepoch=1643974205&from=searchresults#hotelTmpl,"9,0","L'Hôtel Le Nautilus occupe un bâtiment rénové du XVIIe siècle situé dans la ville fortifiée de Saint-Malo. Cet hôtel propose un bar, une bagagerie et un salon commun. ","9, rue de la corne de cerf, Intra muros, 35400 Saint-Malo, France",St Malo,48.6507279,-2.0249312
422,20,Malouinière Le Valmarin,https://www.booking.com/hotel/fr/le-valmarin-malouiniere-du-18eme-siecl.fr.html?aid=304142&ucfs=1&arphpl=1&group_adults=2&req_adults=2&no_rooms=1&group_children=0&req_children=0&hpos=20&hapos=20&sr_order=popularity&srpvid=bb9e50de819a01c2&srepoch=1643974205&from=searchresults#hotelTmpl,"8,2","Situé à 5 minutes à pied des plages de Saint-Malo, l'hôtel Malouinière Le Valmarin est aménagé dans une charmante malouinière datant du XVIIIe siècle, entourée d'un parc clos arboré de 3 000 m². ","7, Rue Jean XXIII, Saint-Servan, 35400 Saint-Malo, France",St Malo,48.6343696,-2.0190965
423,21,Hotel Ar Terra Nova,https://www.booking.com/hotel/fr/ar-terra-nova.fr.html?aid=304142&ucfs=1&arphpl=1&group_adults=2&req_adults=2&no_rooms=1&group_children=0&req_children=0&hpos=21&hapos=21&sr_order=popularity&srpvid=bb9e50de819a01c2&srepoch=1643974205&from=searchresults#hotelTmpl,"8,1","L'hôtel Ar Terra Nova est situé à Saint Malo, à 500 mètres de la plage des Bas Sablons et à 1 km de la vieille ville. ","8 Rue Godard, Saint-Servan, 35400 Saint-Malo, France",St Malo,48.6364576,-2.014197
424,22,Manoir Du Cunningham,https://www.booking.com/hotel/fr/manoir-du-cunningham.fr.html?aid=304142&ucfs=1&arphpl=1&group_adults=2&req_adults=2&no_rooms=1&group_children=0&req_children=0&hpos=22&hapos=22&sr_order=popularity&srpvid=bb9e50de819a01c2&srepoch=1643974205&from=searchresults#hotelTmpl,"8,8","Le Manoir Du Cunningham datant du XVIIe siècle est situé sur le front de mer, à seulement 10 minutes à pied de la vieille ville de Saint-Malo. ","9, Place Monseigneur Duchesne, 35400 Saint-Malo, France",St Malo,48.6363393,-2.020562
425,23,Hôtel de la Cité,https://www.booking.com/hotel/fr/de-la-cite.fr.html?aid=304142&ucfs=1&arphpl=1&group_adults=2&req_adults=2&no_rooms=1&group_children=0&req_children=0&hpos=23&hapos=23&sr_order=popularity&srpvid=bb9e50de819a01c2&srepoch=1643974205&from=searchresults#hotelTmpl,"7,7","L'Hôtel de la Cité se situe au cœur de Saint-Malo, à seulement 350 mètres du port de plaisance de la ville. Il propose une connexion Wi-Fi gratuite et des chambres donnant sur la mer. ","Place Vauban, Intra muros, 35400 Saint-Malo, France",St Malo,48.6515942,-2.0238481
426,24,Le Britannic,https://www.booking.com/hotel/fr/le-britannic.fr.html?aid=304142&ucfs=1&arphpl=1&group_adults=2&req_adults=2&no_rooms=1&group_children=0&req_children=0&hpos=24&hapos=24&sr_order=popularity&srpvid=bb9e50de819a01c2&srepoch=1643974205&from=searchresults#hotelTmpl,"7,9","Situé à Saint-Malo, à moins de 1 km de la plage du Sillon et à 14 minutes à pied de celle d'Eventail, l'établissement Le Britannic propose une connexion Wi-Fi gratuite. ","1 avenue louis martin, 35400 Saint-Malo, France",St Malo,48.6473821,-2.0090441
427,25,Domaine de la Barbinais,https://www.booking.com/hotel/fr/domaine-de-la-barbinais.fr.html?aid=304142&ucfs=1&arphpl=1&group_adults=2&req_adults=2&no_rooms=1&group_children=0&req_children=0&hpos=25&hapos=25&sr_order=popularity&srpvid=bb9e50de819a01c2&srepoch=1643974205&from=searchresults#hotelTmpl,"8,1","L’hôtel Domaine de la Barbinais vous accueille au sein d’un parc paysager de 7 000 m², dans la campagne de Saint-Malo. Une connexion Wi-Fi est disponible dans l’ensemble des locaux. ","La Barbinais, 35400 Saint-Malo, France",St Malo,48.657090755505465,-1.9895390959047399
428,1,Maison Barbillon Grenoble,https://www.booking.com/hotel/fr/maison-barbillon-grenoble.fr.html?aid=304142&ucfs=1&arphpl=1&group_adults=2&req_adults=2&no_rooms=1&group_children=0&req_children=0&hpos=1&hapos=1&sr_order=popularity&srpvid=465d5105d6ea00b5&srepoch=1643974284&from=searchresults#hotelTmpl,"8,3","La Maison Barbillon Grenoble vous accueille à Grenoble, à seulement 100 mètres de la gare. ","10, Rue Barbillon, 38000 Grenoble, France",Grenoble,45.190805049999994,5.716580513626965
429,2,Hôtel de l'Europe Grenoble hyper-centre,https://www.booking.com/hotel/fr/de-l-europe-grenoble.fr.html?aid=304142&ucfs=1&arphpl=1&group_adults=2&req_adults=2&no_rooms=1&group_children=0&req_children=0&hpos=2&hapos=2&sr_order=popularity&srpvid=465d5105d6ea00b5&srepoch=1643974284&from=searchresults#hotelTmpl,"8,4","Situé au cœur de Grenoble, l'Hôtel de l'Europe Grenoble hyper-centre est le plus ancien hôtel de la ville, installé dans un bâtiment datant du XVIIe siècle. ","22 Place Grenette, 38000 Grenoble, France",Grenoble,45.1903354,5.727157624579975
430,3,Novotel Grenoble Centre,https://www.booking.com/hotel/fr/grenoble-centre.fr.html?aid=304142&ucfs=1&arphpl=1&group_adults=2&req_adults=2&no_rooms=1&group_children=0&req_children=0&hpos=3&hapos=3&sr_order=popularity&srpvid=465d5105d6ea00b5&srepoch=1643974284&from=searchresults#hotelTmpl,"7,7","Le Novotel Grenoble Centre est installé au cœur du quartier des affaires de Grenoble, à seulement quelques pas de la gare TGV. ","7 Place Robert Schuman, 38000 Grenoble, France",Grenoble,45.19146,5.7128425
431,4,Adagio Grenoble Centre,https://www.booking.com/hotel/fr/hipark.fr.html?aid=304142&ucfs=1&arphpl=1&group_adults=2&req_adults=2&no_rooms=1&group_children=0&req_children=0&hpos=4&hapos=4&sr_order=popularity&srpvid=465d5105d6ea00b5&srepoch=1643974284&from=searchresults#hotelTmpl,"7,6","L’Adagio Grenoble Centre est situé dans le quartier des affaires Europole, à 5 minutes à pied de la gare TGV de Grenoble et à 10 minutes de marche du centre-ville. ","6 rue Auguste Genin, 38000 Grenoble, France",Grenoble,45.1891998,5.7121883
432,5,Hôtel d’Angleterre Grenoble Hyper-Centre,https://www.booking.com/hotel/fr/tiangleterre.fr.html?aid=304142&ucfs=1&arphpl=1&group_adults=2&req_adults=2&no_rooms=1&group_children=0&req_children=0&hpos=5&hapos=5&sr_order=popularity&srpvid=465d5105d6ea00b5&srepoch=1643974284&from=searchresults#hotelTmpl,"7,9","L'Hôtel d'Angleterre Grenoble Hyper-Centre est situé au cœur de Grenoble, face aux jardins de la place Victor Hugo et à seulement 1 minute à pied de l'arrêt de tramway Victor Hugo. ","5, place Victor Hugo, 38000 Grenoble, France",Grenoble,45.18923995,5.725453065463084
433,6,B&B Hôtel Grenoble Centre Alpexpo,https://www.booking.com/hotel/fr/b-amp-b-grenoble-centre-alpexpo.fr.html?aid=304142&ucfs=1&arphpl=1&group_adults=2&req_adults=2&no_rooms=1&group_children=0&req_children=0&hpos=6&hapos=6&sr_order=popularity&srpvid=465d5105d6ea00b5&srepoch=1643974284&from=searchresults#hotelTmpl,"7,7","Le B&B Grenoble Centre Alpexpo est situé à Grenoble, à seulement 800 mètres d'Alpexpo. Doté d'une réception ouverte 24h/24, il propose une connexion Wi-Fi gratuite et des hébergements insonorisés. ","31, Avenue de l'Europe, 38100 Grenoble, France",Grenoble,45.158938750000004,5.734500985088028
434,7,Residhotel Grenette,https://www.booking.com/hotel/fr/le-royal-grenoble.fr.html?aid=304142&ucfs=1&arphpl=1&group_adults=2&req_adults=2&no_rooms=1&group_children=0&req_children=0&hpos=7&hapos=7&sr_order=popularity&srpvid=465d5105d6ea00b5&srepoch=1643974284&from=searchresults#hotelTmpl,"7,6","Le Residhotel Grenette est situé dans le centre de Grenoble, à 3 minutes à pied de la place Victor Hugo. Il propose un hébergement indépendant avec une connexion Wi-Fi gratuite. ","12 Rue De Palanka, 38000 Grenoble, France",Grenoble,45.1908437,5.7242849
435,8,Hotel Mercure Grenoble Centre Président,https://www.booking.com/hotel/fr/grand-mercure-grenoble-president.fr.html?aid=304142&ucfs=1&arphpl=1&group_adults=2&req_adults=2&no_rooms=1&group_children=0&req_children=0&hpos=8&hapos=8&sr_order=popularity&srpvid=465d5105d6ea00b5&srepoch=1643974284&from=searchresults#hotelTmpl,"7,8","Situé à 10 minutes du centre-ville de Grenoble, l'Hôtel Mercure Grenoble Centre Président est accessible en tramway et par d'autres transports en commun. ","11, Rue Général Mangin, 38100 Grenoble, France",Grenoble,45.17853,5.720102
436,9,Le Grand Hôtel Grenoble,https://www.booking.com/hotel/fr/le-grand-grenoble-centre.fr.html?aid=304142&ucfs=1&arphpl=1&group_adults=2&req_adults=2&no_rooms=1&group_children=0&req_children=0&hpos=9&hapos=9&sr_order=popularity&srpvid=465d5105d6ea00b5&srepoch=1643974284&from=searchresults#hotelTmpl,"8,7","Le Grand Hôtel Grenoble est un établissement 4 étoiles situé dans le centre-ville de Grenoble, à 10 mètres de la place Grenette. Les chambres sont insonorisées et climatisées. ","5 rue de la Republique, 38000 Grenoble, France",Grenoble,45.1908136,5.7285297
437,10,1924 Hôtel,https://www.booking.com/hotel/fr/royal-grenoble.fr.html?aid=304142&ucfs=1&arphpl=1&group_adults=2&req_adults=2&no_rooms=1&group_children=0&req_children=0&hpos=10&hapos=10&sr_order=popularity&srpvid=465d5105d6ea00b5&srepoch=1643974284&from=searchresults#hotelTmpl,"8,5","Doté d’une connexion Wi-Fi gratuite, le 1924 Hôtel est installé au cœur de Grenoble, à seulement 450 mètres de la gare SNCF, à moins de 1 minute à pied de l’arrêt de tramway Alsace-Lorraine. ","2 Rue Gabriel Peri, 38000 Grenoble, France",Grenoble,45.1878293438503,5.719828566899618
438,11,Brit Hotel Suisse et Bordeaux - Centre Gare,https://www.booking.com/hotel/fr/suisse-et-bordeaux.fr.html?aid=304142&ucfs=1&arphpl=1&group_adults=2&req_adults=2&no_rooms=1&group_children=0&req_children=0&hpos=11&hapos=11&sr_order=popularity&srpvid=465d5105d6ea00b5&srepoch=1643974284&from=searchresults#hotelTmpl,"7,0",Le Brit Hôtel Suisse et Bordeaux - Centre Gare vous accueille à proximité d’une rue piétonne et commerçante du centre-ville de Grenoble. ,"6 Place De La Gare, 38000 Grenoble, France",Grenoble,45.1905734,5.715981951976161
439,12,Kyriad Grenoble Centre,https://www.booking.com/hotel/fr/qualityhotelgrenoble.fr.html?aid=304142&ucfs=1&arphpl=1&group_adults=2&req_adults=2&no_rooms=1&group_children=0&req_children=0&hpos=12&hapos=12&sr_order=popularity&srpvid=465d5105d6ea00b5&srepoch=1643974284&from=searchresults#hotelTmpl,"7,8","Situé à Grenoble, à 200 mètres du stade Lesdiguières, le Kyriad Grenoble Centre vous accueille dans un hôtel 3 étoiles doté d'une réception ouverte 24h/24 et d'une connexion Wi-Fi gratuite. ","116 Cours de la Libération, 38100 Grenoble, France",Grenoble,45.1800181,5.7162072
440,13,Residhome Grenoble Caserne De Bonne,https://www.booking.com/hotel/fr/residhome-prestige-grenoble-caserne-de-bonne.fr.html?aid=304142&ucfs=1&arphpl=1&group_adults=2&req_adults=2&no_rooms=1&group_children=0&req_children=0&hpos=13&hapos=13&sr_order=popularity&srpvid=465d5105d6ea00b5&srepoch=1643974284&from=searchresults#hotelTmpl,"7,9","Le Residhome Grenoble Caserne De Bonne est un établissement 4 étoiles situé à Grenoble, à seulement 10 minutes à pied du centre-ville. ","21 Rue Lazare Carnot, 38000 Grenoble, France",Grenoble,45.18351715,5.724433587262631
441,14,Hotel Europole,https://www.booking.com/hotel/fr/europole.fr.html?aid=304142&ucfs=1&arphpl=1&group_adults=2&req_adults=2&no_rooms=1&group_children=0&req_children=0&hpos=14&hapos=14&sr_order=popularity&srpvid=465d5105d6ea00b5&srepoch=1643974284&from=searchresults#hotelTmpl,"7,9","L’Hotel Europole propose des hébergements dans le centre de Grenoble, à moins de 100 mètres de la gare SNCF et à 3 minutes de marche du palais de justice. ","29 Rue Pierre Sémard, 38000 Grenoble, France",Grenoble,45.1931565,5.708858
442,15,Okko Hotels Grenoble Jardin Hoche,https://www.booking.com/hotel/fr/okko-hotels-grenoble-jardin-hoche.fr.html?aid=304142&ucfs=1&arphpl=1&group_adults=2&req_adults=2&no_rooms=1&group_children=0&req_children=0&hpos=15&hapos=15&sr_order=popularity&srpvid=465d5105d6ea00b5&srepoch=1643974284&from=searchresults#hotelTmpl,"8,7","Situé à Grenoble, à proximité immédiate du jardin Hoche, l’Okko Hotels Grenoble Jardin Hoche possède un sauna et une salle de sport. ","23 rue Hoche, 38000 Grenoble, France",Grenoble,45.1848701,5.726246293928222
