,rank,name,link,rate,description,adress,city,latitude,longitude
0,1,Hôtel LÉONOR the place to live,https://www.booking.com/hotel/fr/leonor-the-place-to-live.fr.html?aid=304142&ucfs=1&arphpl=1&group_adults=2&req_adults=2&no_rooms=1&group_children=0&req_children=0&hpos=1&hapos=1&sr_order=popularity&srpvid=b92852fa74f90127&srepoch=1643975286&from=searchresults#hotelTmpl,"9,0","Situé à Strasbourg, à 200 mètres du marché de Noël, l'Hôtel LÉONOR the place to live dispose d'un bar et offre une vue sur la ville. ","11 Rue de la Nuée-Bleue, 67000 Strasbourg, France",Strasbourg,48.5859287,7.7472308
1,2,Best Western Plus Monopole Métropole,https://www.booking.com/hotel/fr/monopolemetropole.fr.html?aid=304142&ucfs=1&arphpl=1&group_adults=2&req_adults=2&no_rooms=1&group_children=0&req_children=0&hpos=2&hapos=2&sr_order=popularity&srpvid=b92852fa74f90127&srepoch=1643975286&from=searchresults#hotelTmpl,"8,7","Le Best Western Monopole Métropole est situé à seulement 400 mètres de la gare de Strasbourg, près du quartier de la Petite France. ","16, rue Kuhn, 67000 Strasbourg, France",Strasbourg,48.5850356,7.7389645
2,3,Adagio Strasbourg Place Kleber,https://www.booking.com/hotel/fr/adagio-city-aparthotel-strasbourg-place-kleber.fr.html?aid=304142&ucfs=1&arphpl=1&group_adults=2&req_adults=2&no_rooms=1&group_children=0&req_children=0&hpos=3&hapos=3&sr_order=popularity&srpvid=b92852fa74f90127&srepoch=1643975286&from=searchresults#hotelTmpl,"8,4",L'Adagio Strasbourg Place Kleber vous accueille au cœur du quartier historique de Strasbourg et à 700 mètres de la gare principale. ,"4 Rue De La Haute Montée, 67000 Strasbourg, France",Strasbourg,48.5842458,7.7456365
3,4,ibis Strasbourg Centre Gare,https://www.booking.com/hotel/fr/ibis-strasbourg-centre-gare.fr.html?aid=304142&ucfs=1&arphpl=1&group_adults=2&req_adults=2&no_rooms=1&group_children=0&req_children=0&hpos=4&hapos=4&sr_order=popularity&srpvid=b92852fa74f90127&srepoch=1643975286&from=searchresults#hotelTmpl,"7,9","Situé en face de la gare, l'ibis Strasbourg Centre Gare possède une réception ouverte 24h/24, un bar, une connexion Wi-Fi gratuite dans l'ensemble de ses locaux ainsi que des hébergements climatisés...","10 place de la Gare, 67000 Strasbourg, France",Strasbourg,48.584455,7.7365257
4,5,Séjours & Affaires Strasbourg Kleber,https://www.booking.com/hotel/fr/residhome-strasbourg-kleber.fr.html?aid=304142&ucfs=1&arphpl=1&group_adults=2&req_adults=2&no_rooms=1&group_children=0&req_children=0&hpos=5&hapos=5&sr_order=popularity&srpvid=b92852fa74f90127&srepoch=1643975286&from=searchresults#hotelTmpl,"8,0","Cette résidence propose un hébergement individuel confortable. Elle se trouve dans une rue calme du centre-ville, à 5 minutes à pied du quartier historique de la Petite France et de la cathédrale de...","16 Rue Hannong, 67000 Strasbourg, France",Strasbourg,48.5832665,7.7428271
5,6,"Holiday Inn Express Strasbourg Centre, an IHG Hotel",https://www.booking.com/hotel/fr/holiday-inn-express-strasbourg-centre.fr.html?aid=304142&ucfs=1&arphpl=1&group_adults=2&req_adults=2&no_rooms=1&group_children=0&req_children=0&hpos=6&hapos=6&sr_order=popularity&srpvid=b92852fa74f90127&srepoch=1643975286&from=searchresults#hotelTmpl,"8,2",Le Holiday Inn Express Strasbourg Centre propose des hébergements à seulement 10 minutes de marche du quartier piéton de Strasbourg. ,"Rue de la Corderie, 67000 Strasbourg, France",Strasbourg,48.572237,7.7499584
6,7,Hotel Beaucour,https://www.booking.com/hotel/fr/beaucour.fr.html?aid=304142&ucfs=1&arphpl=1&group_adults=2&req_adults=2&no_rooms=1&group_children=0&req_children=0&hpos=7&hapos=7&sr_order=popularity&srpvid=b92852fa74f90127&srepoch=1643975286&from=searchresults#hotelTmpl,"8,6","Construit autour d'une cour fleurie et doté d'un salon commun orné d'une cheminée, l'hôtel Beaucour propose des hébergements dans le centre de Strasbourg, à seulement 400 mètres de la cathédrale de la...","5 rue des Bouchers, 67000 Strasbourg, France",Strasbourg,48.5786602,7.751427
7,8,HANNONG Hotel & Wine Bar,https://www.booking.com/hotel/fr/tihannong.fr.html?aid=304142&ucfs=1&arphpl=1&group_adults=2&req_adults=2&no_rooms=1&group_children=0&req_children=0&hpos=8&hapos=8&sr_order=popularity&srpvid=b92852fa74f90127&srepoch=1643975286&from=searchresults#hotelTmpl,"8,8","L'Hôtel Hannong est situé au cœur de Strasbourg, à seulement 5 minutes de marche de la gare TGV, de la cathédrale et du quartier de la Petite France. ","15, rue du 22 Novembre, 67000 Strasbourg, France",Strasbourg,48.5828444,7.7431081
8,9,Pax Hôtel,https://www.booking.com/hotel/fr/hotelrestaurantpax.fr.html?aid=304142&ucfs=1&arphpl=1&group_adults=2&req_adults=2&no_rooms=1&group_children=0&req_children=0&hpos=9&hapos=9&sr_order=popularity&srpvid=b92852fa74f90127&srepoch=1643975286&from=searchresults#hotelTmpl,"7,5","Le Citotel Hotel Pax, un établissement à la gestion familiale, vous accueille à 400 mètres de la gare TGV de Strasbourg et de la station de tramway. Vous séjournerez à 600 mètres du centre-ville. ","24 rue du Faubourg National, 67000 Strasbourg, France",Strasbourg,48.5825035,7.7369842
9,10,Citadines Eurometropole Strasbourg,https://www.booking.com/hotel/fr/citadines-eurometropole-strasbourg.fr.html?aid=304142&ucfs=1&arphpl=1&group_adults=2&req_adults=2&no_rooms=1&group_children=0&req_children=0&hpos=10&hapos=10&sr_order=popularity&srpvid=b92852fa74f90127&srepoch=1643975286&from=searchresults#hotelTmpl,"8,5","Situé à Strasbourg, à 3,7 km de la Petite France, le Citadines Eurometropole Strasbourg dispose d'un restaurant ainsi que d'un centre de spa et de bien-être avec une piscine intérieure, une salle de...","11 Allée de l’Euro, 67205 Strasbourg, France",Strasbourg,48.6032396,7.7038519
10,11,Hilton Strasbourg,https://www.booking.com/hotel/fr/hilton-strasbourg.fr.html?aid=304142&ucfs=1&arphpl=1&group_adults=2&req_adults=2&no_rooms=1&group_children=0&req_children=0&hpos=11&hapos=11&sr_order=popularity&srpvid=b92852fa74f90127&srepoch=1643975286&from=searchresults#hotelTmpl,"7,4",L'hôtel Hilton Strasbourg se situe à proximité du Parlement européen et à seulement 3 arrêts de tramway du centre-ville de Strasbourg. ,"1 Avenue Herrenschmidt, 67000 Strasbourg, France",Strasbourg,48.5969958,7.754686249422028
11,12,K Hotel,https://www.booking.com/hotel/fr/k-strasbourg.fr.html?aid=304142&ucfs=1&arphpl=1&group_adults=2&req_adults=2&no_rooms=1&group_children=0&req_children=0&hpos=12&hapos=12&sr_order=popularity&srpvid=b92852fa74f90127&srepoch=1643975286&from=searchresults#hotelTmpl,"8,8","Situé à Strasbourg, le K Hotel dispose d'une salle de sport et offre une vue sur la ville. ","3 allée Cérès , 67200 Strasbourg, France",Strasbourg,48.5938876,7.7138813
12,13,Hôtel Gutenberg,https://www.booking.com/hotel/fr/gutenberg.fr.html?aid=304142&ucfs=1&arphpl=1&group_adults=2&req_adults=2&no_rooms=1&group_children=0&req_children=0&hpos=13&hapos=13&sr_order=popularity&srpvid=b92852fa74f90127&srepoch=1643975286&from=searchresults#hotelTmpl,"8,6","Idéalement situé dans le centre-ville de Strasbourg, en face de la cathédrale et à côté du quartier historique de la Petite-France, l'Hotel Gutenberg dispose d'une connexion Wi-Fi gratuite. ","31 Rue Des Serruriers, 67000 Strasbourg, France",Strasbourg,48.5810757,7.7477736
13,14,"voco Strasbourg Centre - The Garden, an IHG Hotel",https://www.booking.com/hotel/fr/golden-tulip-strasbourg-centre-the-garden.fr.html?aid=304142&ucfs=1&arphpl=1&group_adults=2&req_adults=2&no_rooms=1&group_children=0&req_children=0&hpos=14&hapos=14&sr_order=popularity&srpvid=b92852fa74f90127&srepoch=1643975286&from=searchresults#hotelTmpl,"8,6","Doté d'un jardin et d'un restaurant, le Voco - Strasbourg Centre - The Garden - Garden est situé à Strasbourg. Il comporte une terrasse, un salon commun et un bar. ","9 Rue des Magasins, 67000 Strasbourg, France",Strasbourg,48.5897413,7.7396261
14,15,Hotel Victoria,https://www.booking.com/hotel/fr/hotelvictoria.fr.html?aid=304142&ucfs=1&arphpl=1&group_adults=2&req_adults=2&no_rooms=1&group_children=0&req_children=0&hpos=15&hapos=15&sr_order=popularity&srpvid=b92852fa74f90127&srepoch=1643975286&from=searchresults#hotelTmpl,"7,8","L'hôtel vous accueille dans une atmosphère chaleureuse et bénéficie d'un emplacement de choix dans le centre-ville, près des berges de l'Ill et du quartier historique de la Petite France, à deux pas...","7-9 Rue du Maire Kuss, 67000 Strasbourg, France",Strasbourg,48.5837322,7.7377007
15,16,Comfort Hotel Strasbourg - Montagne Verte & Restaurant Louisiane,https://www.booking.com/hotel/fr/comforthotelstras.fr.html?aid=304142&ucfs=1&arphpl=1&group_adults=2&req_adults=2&no_rooms=1&group_children=0&req_children=0&hpos=16&hapos=16&sr_order=popularity&srpvid=b92852fa74f90127&srepoch=1643975286&from=searchresults#hotelTmpl,"8,4","Situé près de l'Ill, le Comfort Hotel Strasbourg - Montagne Verte Restaurant Louisiane se trouve à 2 km du quartier historique. Il dispose d'un restaurant avec terrasse d'été et d'un jardin. ","14, rue des Corroyeurs, 67200 Strasbourg, France",Strasbourg,48.5726894,7.7287234
16,17,Appart'City Strasbourg Centre,https://www.booking.com/hotel/fr/appart-city-strasbourg.fr.html?aid=304142&ucfs=1&arphpl=1&group_adults=2&req_adults=2&no_rooms=1&group_children=0&req_children=0&hpos=17&hapos=17&sr_order=popularity&srpvid=b92852fa74f90127&srepoch=1643975286&from=searchresults#hotelTmpl,"7,8","L’Appart'City Strasbourg Centre bénéficie d’un emplacement idéal dans le centre de Strasbourg, à 10 minutes de marche de la gare. ","11 rue de Molsheim, 67000 Strasbourg, France",Strasbourg,48.5777174,7.7339917
17,18,Le Kléber Hôtel,https://www.booking.com/hotel/fr/le-kleber.fr.html?aid=304142&ucfs=1&arphpl=1&group_adults=2&req_adults=2&no_rooms=1&group_children=0&req_children=0&hpos=18&hapos=18&sr_order=popularity&srpvid=b92852fa74f90127&srepoch=1643975286&from=searchresults#hotelTmpl,"7,9",L'établissement Le Kléber Hôtel vous accueille dans le centre-ville historique de Strasbourg. Il propose des chambres joliment décorées avec télévision à écran plat et connexion Internet gratuite. ,"29 Place Kleber, 67000 Strasbourg, France",Strasbourg,48.583310600000004,7.7459617902997895
18,19,EtC...Hôtel - Strasbourg Hyper Centre,https://www.booking.com/hotel/fr/des-francs-bourgeois.fr.html?aid=304142&ucfs=1&arphpl=1&group_adults=2&req_adults=2&no_rooms=1&group_children=0&req_children=0&hpos=19&hapos=19&sr_order=popularity&srpvid=b92852fa74f90127&srepoch=1643975286&from=searchresults#hotelTmpl,"7,9","L'EtC ... Hôtel est situé à Strasbourg, à proximité du quartier la Petite France. Il propose des chambres modernes et un cadre paisible. ","7 Rue De La Chaîne, 67000 Strasbourg, France",Strasbourg,48.5808069,7.7461763
19,20,Hôtel De L'Ill,https://www.booking.com/hotel/fr/de-l-ill.fr.html?aid=304142&ucfs=1&arphpl=1&group_adults=2&req_adults=2&no_rooms=1&group_children=0&req_children=0&hpos=20&hapos=20&sr_order=popularity&srpvid=b92852fa74f90127&srepoch=1643975286&from=searchresults#hotelTmpl,"8,8","L'Hôtel De L'ill vous accueille à Strasbourg,dans une rue à sens unique, à mi-chemin entre la cathédrale et l'université. Il vous propose une grande terrasse et des hébergements modernes. ","8 rue des Bateliers, 67000 Strasbourg, France",Strasbourg,48.5806537,7.7550983
20,21,Hotel Suisse,https://www.booking.com/hotel/fr/suisse-strasbourg.fr.html?aid=304142&ucfs=1&arphpl=1&group_adults=2&req_adults=2&no_rooms=1&group_children=0&req_children=0&hpos=21&hapos=21&sr_order=popularity&srpvid=b92852fa74f90127&srepoch=1643975286&from=searchresults#hotelTmpl,"8,8","Situé dans un quartier central, l’Hotel Suisse vous accueille derrière la cathédrale de Strasbourg. Cet établissement à la gestion familiale propose une connexion Wi-Fi gratuite et une terrasse en...","2-4, Rue De La Rape, 67000 Strasbourg, France",Strasbourg,48.5816425,7.7528753
21,22,Hotel Roses,https://www.booking.com/hotel/fr/hotelauxtroisroses.fr.html?aid=304142&ucfs=1&arphpl=1&group_adults=2&req_adults=2&no_rooms=1&group_children=0&req_children=0&hpos=22&hapos=22&sr_order=popularity&srpvid=b92852fa74f90127&srepoch=1643975286&from=searchresults#hotelTmpl,"8,1","L’Hotel Roses vous propose 34 chambres décorées sur le thème des roses. Les hébergements sont insonorisés, spacieux et lumineux. ","7 rue de Zurich, 67000 Strasbourg, France",Strasbourg,48.5811453,7.7563978
22,23,Le Grand Hotel,https://www.booking.com/hotel/fr/legrandhotel.fr.html?aid=304142&ucfs=1&arphpl=1&group_adults=2&req_adults=2&no_rooms=1&group_children=0&req_children=0&hpos=23&hapos=23&sr_order=popularity&srpvid=b92852fa74f90127&srepoch=1643975286&from=searchresults#hotelTmpl,"8,3","Le Grand Hôtel est situé en face de la gare de Strasbourg, à 10 minutes à pied du centre-ville et de la place Kléber. Il dispose d'un bar, d'une terrasse et d'une connexion Wi-Fi gratuite. ","12, Place de la Gare, 67000 Strasbourg, France",Strasbourg,48.5846875,7.7365797
23,24,Appartements Le 32,https://www.booking.com/hotel/fr/le.fr.html?aid=304142&ucfs=1&arphpl=1&group_adults=2&req_adults=2&no_rooms=1&group_children=0&req_children=0&hpos=24&hapos=24&sr_order=popularity&srpvid=b92852fa74f90127&srepoch=1643975286&from=searchresults#hotelTmpl,"8,8","L'établissement Le 32 propose un hébergement indépendant et idéalement situé dans le centre de Strasbourg, près de la cathédrale et de la célèbre place Gutenberg. ","32 Rue de l'Ail, 67000 Strasbourg, France",Strasbourg,48.5800364,7.7489416
24,25,Montempô Apparthôtel Strasbourg,https://www.booking.com/hotel/fr/montempo-apparthotel-strasbourg.fr.html?aid=304142&ucfs=1&arphpl=1&group_adults=2&req_adults=2&no_rooms=1&group_children=0&req_children=0&hpos=25&hapos=25&sr_order=popularity&srpvid=b92852fa74f90127&srepoch=1643975286&from=searchresults#hotelTmpl,"6,9","Le Montempô Apparthôtel Strasbourg propose des hébergements indépendants dotés d'une connexion Wi-Fi gratuite à proximité directe du centre de Strasbourg, à 900 mètres du quartier historique de la...","3 Rue de Koenigshoffen, 67000 Strasbourg, France",Strasbourg,48.5579842,7.679859
